{
 "description": "PHPS base all-SG mirror of PF '1. Power Flow' -- 3ph Bus 16, 160 ms clearing (CCT sweep)",
 "system": "system_phtrue.json",
 "solver": {
  "method": "ida",
  "dt": 0.0005,
  "duration": 6.0,
  "log_dt": 0.001
 },
 "events": [
  {
   "type": "BusFault",
   "bus": 16,
   "r": 0.0001,
   "x": 0.0001,
   "t_start": 1.0,
   "t_duration": 0.16
  }
 ],
 "output": {
  "directory": "outputs/IEEE39Bus_PF_base_bus16_160ms"
 }
}