{
 "description": "PHPS GFL WITH terminal impedance (x_if = uk 10% as a true state), ki_P=1.0 to match the current-source case.  40 ms bolted Bus 16, log at the solver step.",
 "system": "system_gfl_zif_kiP1p0.json",
 "solver": {
  "method": "bdf1",
  "dt": 0.00025,
  "log_dt": 0.00025,
  "duration": 6.0
 },
 "events": [
  {
   "type": "BusFault",
   "bus": 16,
   "r": 0.0,
   "x": 1e-06,
   "t_start": 1.0,
   "t_duration": 0.04
  }
 ],
 "output": {
  "directory": "phps/outputs/IEEE39Bus_PF_gfl_zif_bus16_40ms_kiP1p0_log250us"
 }
}
